"","Title","Authors","Source Title","Publication Year","Total Citations"
"282","A new cavity based absorption instrument for detection of water isotopologues in the upper troposphere and lower stratosphere","Kroll;O'Brien","REVIEW OF SCIENTIFIC INSTRUMENTS",2009,68
"283","Evolution of Organic Aerosols in the Atmosphere","Kroll;Williams;Williams","SCIENCE",2009,2239
"284","Isoprene photooxidation: new insights into the production of acids and organic nitrates","Kroll;Wennberg","ATMOSPHERIC CHEMISTRY AND PHYSICS",2009,295
"285","Investigation of the correlation between odd oxygen and secondary organic aerosol in Mexico City and Houston","Kroll;Williams;Williams","ATMOSPHERIC CHEMISTRY AND PHYSICS",2010,62
"286","Mass Spectral Analysis of Organic Aerosol Formed Downwind of the Deepwater Horizon Oil Spill: Field Studies and Laboratory Confirmations","Kroll;Williams;Williams;de Gouw","ENVIRONMENTAL SCIENCE & TECHNOLOGY",2012,32
"287","Why do organic aerosols exist? Understanding aerosol lifetimes using the two-dimensional volatility basis set","Kroll;Adams","ENVIRONMENTAL CHEMISTRY",2013,75
"288","Elemental ratio measurements of organic compounds using aerosol mass spectrometry: characterization, improved calibration, and implications","Kroll;Williams;Williams;Ruiz","ATMOSPHERIC CHEMISTRY AND PHYSICS",2015,461
"289","The Essential Role for Laboratory Studies in Atmospheric Chemistry","Kroll;Abbatt;Ziemann;McNeill","ENVIRONMENTAL SCIENCE & TECHNOLOGY",2017,45
"290","Chemical Characterization of Isoprene- and Monoterpene-Derived Secondary Organic Aerosol Tracers in Remote Marine Aerosols over a Quarter Century","Kroll;O'Brien","ACS EARTH AND SPACE CHEMISTRY",2019,13
"291","Inferring Aerosol Sources from Low-Cost Air Quality Sensor Measurements: A Case Study in Delhi, India","Kroll;Ruiz","ENVIRONMENTAL SCIENCE & TECHNOLOGY LETTERS",2019,7
"292","Infrared Ion Spectroscopy of Environmental Organic Mixtures: Probing the Composition of alpha-Pinene Secondary Organic Aerosol","Kroll;O'Brien","ENVIRONMENTAL SCIENCE & TECHNOLOGY",2019,6
"293","OH chemistry of non-methane organic gases (NMOGs) emitted from laboratory and ambient biomass burning smoke: evaluating the influence of furans and oxygenated aromatics on ozone and secondary NMOG formation","Kroll;de Gouw","ATMOSPHERIC CHEMISTRY AND PHYSICS",2019,21
"294","Photolytic Aging of Secondary Organic Aerosol: Evidence for a Substantial Photo-Recalcitrant Fraction","Kroll;O'Brien","JOURNAL OF PHYSICAL CHEMISTRY LETTERS",2019,12
"295","Secondary organic aerosol formation from the laboratory oxidation of biomass burning emissions","Kroll;de Gouw","ATMOSPHERIC CHEMISTRY AND PHYSICS",2019,32
"296","Ultrasonic nebulization for the elemental analysis of microgram-level samples with offline aerosol mass spectrometry","Kroll;O'Brien","ATMOSPHERIC MEASUREMENT TECHNIQUES",2019,7
"297","A biogenic secondary organic aerosol source of cirrus ice nucleating particles","Kroll;Abbatt","NATURE COMMUNICATIONS",2020,5
"298","Biomass-burning-derived particles from a wide variety of fuels - Part 2: Effects of photochemical aging on particle optical and chemical properties","Kroll;de Gouw","ATMOSPHERIC CHEMISTRY AND PHYSICS",2020,10
"299","Oxygenated Aromatic Compounds are Important Precursors of Secondary Organic Aerosol in Biomass-Burning Emissions","Kroll;de Gouw","ENVIRONMENTAL SCIENCE & TECHNOLOGY",2020,11
"300","Simultaneous detection of perchlorate and bromate using rapid high-performance ion exchange chromatography-tandem mass spectrometry and perchlorate removal in drinking water","Burken;Adams","ENVIRONMENTAL SCIENCE AND POLLUTION RESEARCH",2015,12
"301","Characterization of aerosol photooxidation flow reactors: heterogeneous oxidation, secondary organic aerosol formation and cloud condensation nuclei activity measurements","Abbatt;Williams;Williams","ATMOSPHERIC MEASUREMENT TECHNIQUES",2011,184
"302","The role of long-lived reactive oxygen intermediates in the reaction of ozone with aerosol particles","Abbatt;Shiraiwa","NATURE CHEMISTRY",2011,126
"303","Kinetic limitations in gas-particle reactions arising from slow diffusion in secondary organic aerosol","Abbatt;Shiraiwa","FARADAY DISCUSSIONS",2013,93
"304","A review of air-ice chemical and physical interactions (AICI): liquids, quasi-liquids, and solids in snow","Abbatt;Kahan;McNeill","ATMOSPHERIC CHEMISTRY AND PHYSICS",2014,151
"305","Collection efficiency of the soot-particle aerosol mass spectrometer (SP-AMS) for internally mixed particulate black carbon","Abbatt;Williams;Williams","ATMOSPHERIC MEASUREMENT TECHNIQUES",2014,48
"306","A marine biogenic source of atmospheric ice-nucleating particles","Abbatt;Carslaw","NATURE",2015,274
"307","Observations and impacts of bleach washing on indoor chlorine chemistry","Abbatt;Carslaw","INDOOR AIR",2017,52
"308","Ice-nucleating ability of aerosol particles and possible sources at three coastal marine sites","Abbatt;Carslaw","ATMOSPHERIC CHEMISTRY AND PHYSICS",2018,21
"309","Multiphase reactivity of polycyclic aromatic hydrocarbons is driven by phase separation and diffusion limitations","Abbatt;Shiraiwa","PROCEEDINGS OF THE NATIONAL ACADEMY OF SCIENCES OF THE UNITED STATES OF AMERICA",2019,32
"310","Organic Peroxides and Sulfur Dioxide in Aerosol: Source of Particulate Sulfate","Abbatt;McNeill","ENVIRONMENTAL SCIENCE & TECHNOLOGY",2019,19
"311","Sources of isocyanic acid (HNCO) indoors: a focus on cigarette smoke","Abbatt;Borduas-Dedekind","ENVIRONMENTAL SCIENCE-PROCESSES & IMPACTS",2019,9
"312","Reactive Uptake of Ozone to Simulated Seawater: Evidence for Iodide Depletion","Abbatt;Shiraiwa","JOURNAL OF PHYSICAL CHEMISTRY A",2020,0
"313","Global atmospheric budget of acetaldehyde: 3-D model analysis and constraints from in-situ and satellite observations","Williams;de Gouw","ATMOSPHERIC CHEMISTRY AND PHYSICS",2010,183
"314","GLOVOCS - Master compound assignment guide for proton transfer reaction mass spectrometry users","Williams;de Gouw","ATMOSPHERIC ENVIRONMENT",2021,4
"315","Sources of particulate matter in the northeastern United States in summer: 1. Direct emissions and secondary formation of organic matter in urban plumes","de Gouw;Williams;Williams","JOURNAL OF GEOPHYSICAL RESEARCH-ATMOSPHERES",2008,126
"316","Measurements of volatile organic compounds during the 2006 TexAQS/GoMACCS campaign: Industrial influences, regional characteristics, and diurnal dependencies of the OH reactivity","de Gouw;Williams;Williams","JOURNAL OF GEOPHYSICAL RESEARCH-ATMOSPHERES",2009,76
"317","Radicals in the marine boundary layer during NEAQS 2004: a model study of day-time and night-time sources and sinks","de Gouw;Williams;Williams","ATMOSPHERIC CHEMISTRY AND PHYSICS",2009,18
"318","Regional variation of the dimethyl sulfide oxidation mechanism in the summertime marine boundary layer in the Gulf of Maine","de Gouw;Williams;Williams","JOURNAL OF GEOPHYSICAL RESEARCH-ATMOSPHERES",2009,18
"319","Closing the Peroxy Acetyl (PA) Radical Budget: Observations of Acyl Peroxy Nitrates (PAN, PPN, and MPAN) During BEARPEX 2007","de Gouw;Goldstein","AIR POLLUTION MODELING AND ITS APPLICATION XX",2010,1
"320","Contribution of isoprene-derived organosulfates to free tropospheric aerosol mass","de Gouw;Wennberg","PROCEEDINGS OF THE NATIONAL ACADEMY OF SCIENCES OF THE UNITED STATES OF AMERICA",2010,140
"321","Ozone variability and halogen oxidation within the Arctic and sub-Arctic springtime boundary layer","de Gouw;Williams;Williams","ATMOSPHERIC CHEMISTRY AND PHYSICS",2010,75
"322","Evaluations of NOx and highly reactive VOC emission inventories in Texas and their implications for ozone plume simulations during the Texas Air Quality Study 2006","de Gouw;Williams;Williams","ATMOSPHERIC CHEMISTRY AND PHYSICS",2011,62
"323","Importance of secondary sources in the atmospheric budgets of formic and acetic acids","de Gouw;Wennberg","ATMOSPHERIC CHEMISTRY AND PHYSICS",2011,195
"324","Modelled and measured concentrations of peroxy radicals and nitrate radical in the US Gulf Coast region during TexAQS 2006","de Gouw;Williams;Williams","JOURNAL OF ATMOSPHERIC CHEMISTRY",2011,7
"325","Ozone production in remote oceanic and industrial areas derived from ship based measurements of peroxy radicals during TexAQS 2006","de Gouw;Williams;Williams","ATMOSPHERIC CHEMISTRY AND PHYSICS",2011,10
"326","Nitryl Chloride and Molecular Chlorine in the Coastal Marine Boundary Layer","de Gouw;Williams;Williams","ENVIRONMENTAL SCIENCE & TECHNOLOGY",2012,125
"327","The sea breeze/land breeze circulation in Los Angeles and its influence on nitryl chloride production in this region","de Gouw;Williams;Williams","JOURNAL OF GEOPHYSICAL RESEARCH-ATMOSPHERES",2012,38
"328","A portable and inexpensive method for quantifying ambient intermediate volatility organic compounds","de Gouw;Ruiz","ATMOSPHERIC ENVIRONMENT",2014,6
"329","Conversion of hydroperoxides to carbonyls in field and laboratory instrumentation: Observational bias in diagnosing pristine versus anthropogenically controlled atmospheric chemistry","de Gouw;Wennberg","GEOPHYSICAL RESEARCH LETTERS",2014,69
"330","Fine-scale simulation of ammonium and nitrate over the South Coast Air Basin and San Joaquin Valley of California during CalNex-2010","de Gouw;VandenBoer","JOURNAL OF GEOPHYSICAL RESEARCH-ATMOSPHERES",2014,39
"331","High winter ozone pollution from carbonyl photolysis in an oil and gas basin","de Gouw;Young","NATURE",2014,154
"332","Measurements of hydrogen sulfide (H2S) using PTR-MS: calibration, humidity dependence, inter-comparison and results from field studies in an oil and gas production region","de Gouw;Geiger","ATMOSPHERIC MEASUREMENT TECHNIQUES",2014,17
"333","New insights into atmospheric sources and sinks of isocyanic acid, HNCO, from recent urban and regional observations","de Gouw;Williams;Williams;VandenBoer","JOURNAL OF GEOPHYSICAL RESEARCH-ATMOSPHERES",2014,28
"334","Volatile organic compound emissions from the oil and natural gas industry in the Uintah Basin, Utah: oil and gas well pad emissions compared to ambient air composition","de Gouw;Geiger","ATMOSPHERIC CHEMISTRY AND PHYSICS",2014,71
"335","Investigation of secondary formation of formic acid: urban environment vs. oil and gas producing region","de Gouw;Williams;Williams","ATMOSPHERIC CHEMISTRY AND PHYSICS",2015,41
"336","Understanding high wintertime ozone pollution events in an oil- and natural gas-producing region of the western US","de Gouw;Williams;Williams","ATMOSPHERIC CHEMISTRY AND PHYSICS",2015,91
"337","Contribution of human-related sources to indoor volatile organic compounds in a university classroom","de Gouw;Ziemann","INDOOR AIR",2016,44
"338","Influence of oil and gas emissions on summertime ozone in the Colorado Northern Front Range","de Gouw;Williams;Williams","JOURNAL OF GEOPHYSICAL RESEARCH-ATMOSPHERES",2016,62
"339","Observational constraints on glyoxal production from isoprene oxidation and its contribution to organic aerosol over the Southeast United States","de Gouw;McNeill","JOURNAL OF GEOPHYSICAL RESEARCH-ATMOSPHERES",2016,27
"340","Effects of gas-wall partitioning in Teflon tubing and instrumentation on time-resolved measurements of gas-phase organic compounds","de Gouw;Ziemann","ATMOSPHERIC MEASUREMENT TECHNIQUES",2017,63
"341","Identification and Quantification of 4-Nitrocatechol Formed from OH and NO3 Radical-Initiated Reactions of Catechol in Air in the Presence of NOx: Implications for Secondary Organic Aerosol Formation from Biomass Burning","de Gouw;Ziemann","ENVIRONMENTAL SCIENCE & TECHNOLOGY",2018,57
"342","Nitrous acid formation in a snow-free wintertime polluted rural area","de Gouw;Williams;Williams","ATMOSPHERIC CHEMISTRY AND PHYSICS",2018,13
"343","Southeast Atmosphere Studies: learning from model-observation syntheses","de Gouw;McNeill","ATMOSPHERIC CHEMISTRY AND PHYSICS",2018,24
"344","Autoxidation of Limonene Emitted in a University Art Museum","de Gouw;Ziemann","ENVIRONMENTAL SCIENCE & TECHNOLOGY LETTERS",2019,8
"345","Budgets of Organic Carbon Composition and Oxidation in Indoor Air","de Gouw;Ziemann","ENVIRONMENTAL SCIENCE & TECHNOLOGY",2019,11
"346","Effects of gas-wall interactions on measurements of semivolatile compounds and small polar molecules","de Gouw;Ziemann","ATMOSPHERIC MEASUREMENT TECHNIQUES",2019,22
"347","Measurements of delays of gas-phase compounds in a wide variety of tubing materials due to gas-wall interactions","de Gouw;Ziemann","ATMOSPHERIC MEASUREMENT TECHNIQUES",2019,35
"348","Products and Secondary Organic Aerosol Yields from the OH and NO3 Radical-Initiated Oxidation of Resorcinol","de Gouw;Ziemann","ACS EARTH AND SPACE CHEMISTRY",2019,8
"349","Simulating the Weekly Cycle of NOx-VOC-HOx-O-3 Photochemical System in the South Coast of California During CalNex-2010 Campaign","de Gouw;Stevens","JOURNAL OF GEOPHYSICAL RESEARCH-ATMOSPHERES",2019,1
"350","Time-Resolved Measurements of Indoor Chemical Emissions, Deposition, and Reactions in a University Art Museum","de Gouw;Ziemann","ENVIRONMENTAL SCIENCE & TECHNOLOGY",2019,28
"351","Measurements and modeling of absorptive partitioning of volatile organic compounds to painted surfaces","de Gouw;Ziemann","INDOOR AIR",2020,9
"352","An in situ gas chromatograph with automatic detector switching between PTR- and EI-TOF-MS: isomer-resolved measurements of indoor air","de Gouw;Ziemann","ATMOSPHERIC MEASUREMENT TECHNIQUES",2021,1
"353","How ant acid forms in the atmosphere","de Gouw;Farmer","NATURE",2021,0
"354","Measurements of Total OH Reactivity During CalNex-LA","de Gouw;Young;Stevens","JOURNAL OF GEOPHYSICAL RESEARCH-ATMOSPHERES",2021,0
"355","Quantification and source characterization of volatile organic compounds from exercising and application of chlorine-based cleaning products in a university athletic center","de Gouw;Ziemann","INDOOR AIR",2021,3
"356","Secondary organic aerosols from anthropogenic volatile organic compounds contribute substantially to air pollution mortality","de Gouw;Young","ATMOSPHERIC CHEMISTRY AND PHYSICS",2021,1
"357","Sources of Gas-Phase Species in an Art Museum from Comprehensive Real-Time Measurements","de Gouw;Ziemann","ACS EARTH AND SPACE CHEMISTRY",2021,0
"358","A paradigm shift to combat indoor respiratory infection Building ventilation systems must get much better","Prather;Nazaroff","SCIENCE",2021,9
"359","Advancing Model Systems for Fundamental Laboratory Studies of Sea Spray Aerosol Using the Microbial Loop","Prather;Grassian","JOURNAL OF PHYSICAL CHEMISTRY A",2015,42
"360","Analysis of Atmospheric Aerosols","Prather;Grassian","ANNUAL REVIEW OF ANALYTICAL CHEMISTRY",2008,109
"361","Analysis of Organic Anionic Surfactants in Fine and Coarse Fractions of Freshly Emitted Sea Spray Aerosol","Prather;Grassian","ENVIRONMENTAL SCIENCE & TECHNOLOGY",2016,86
"362","Cation-Driven Lipopolysaccharide Morphological Changes Impact Heterogeneous Reactions of Nitric Acid with Sea Spray Aerosol Particles","Prather;Grassian","JOURNAL OF PHYSICAL CHEMISTRY LETTERS",2021,0
"363","Composition and hygroscopicity of the Los Angeles Aerosol: CalNex","Prather;Shiraiwa","JOURNAL OF GEOPHYSICAL RESEARCH-ATMOSPHERES",2013,63
"364","Detection of Active Microbial Enzymes in Nascent Sea Spray Aerosol: Implications for Atmospheric Chemistry and Climate","Prather;Grassian","ENVIRONMENTAL SCIENCE & TECHNOLOGY LETTERS",2019,9
"365","Direct aerosol chemical composition measurements to evaluate the physicochemical differences between controlled sea spray aerosol generation schemes","Prather;Grassian","ATMOSPHERIC MEASUREMENT TECHNIQUES",2014,61
"366","Heterogeneous Chemistry of Lipopolysaccharides with Gas-Phase Nitric Acid: Reactive Sites and Reaction Pathways","Prather;Grassian","JOURNAL OF PHYSICAL CHEMISTRY A",2016,12
"367","Impacts of Lipase Enzyme on the Surface Properties of Marine Aerosols","Prather;Grassian","JOURNAL OF PHYSICAL CHEMISTRY LETTERS",2018,11
"368","Importance of composition and hygroscopicity of BC particles to the effect of BC mitigation on cloud properties: Application to California conditions","Prather;Adams","JOURNAL OF GEOPHYSICAL RESEARCH-ATMOSPHERES",2012,7
"369","Improving our fundamental understanding of the role of aerosol-cloud interactions in the climate system","Prather;Carslaw","PROCEEDINGS OF THE NATIONAL ACADEMY OF SCIENCES OF THE UNITED STATES OF AMERICA",2016,243
"370","Liquid Sampling-Atmospheric Pressure Glow Discharge Ionization as a Technique for the Characterization of Salt-Containing Organic Samples","Prather;Grassian","ANALYTICAL CHEMISTRY",2020,3
"371","Microbial Control of Sea Spray Aerosol Composition: A Tale of Two Blooms","Prather;Grassian","ACS CENTRAL SCIENCE",2015,107
"372","Multiscale mechanisms of cell migration during development: theory and experiment","Prather;Morrison","DEVELOPMENT",2012,102
"373","Organic Enrichment, Physical Phase State, and Surface Tension Depression of Nascent Core-Shell Sea Spray Aerosols during Two Phytoplankton Blooms","Prather;Grassian","ACS EARTH AND SPACE CHEMISTRY",2020,7
"374","Physicochemical Mixing State of Sea Spray Aerosols: Morphologies Exhibit Size Dependence","Prather;Grassian","ACS EARTH AND SPACE CHEMISTRY",2020,2
"375","Shedding Light on Photosensitized Reactions within Marine-Relevant Organic Thin Films","Prather;Grassian","ACS EARTH AND SPACE CHEMISTRY",2019,8
"376","Shipboard measurements of gaseous elemental mercury along the coast of Central and Southern California","Prather;Williams;Williams","JOURNAL OF GEOPHYSICAL RESEARCH-ATMOSPHERES",2013,13
"377","The Old and the New: Aging of Sea Spray Aerosol and Formation of Secondary Marine Aerosol through OH Oxidation Reactions","Prather;Grassian","ACS EARTH AND SPACE CHEMISTRY",2019,6
"378","Tools for the Microbiome: Nano and Beyond","Prather;Young","ACS NANO",2016,91
"379","Decomposition of perfluorooctane sulfonate (PFOS) using a hybrid process with electron beam and chemical oxidants","Doudrick;Young","CHEMICAL ENGINEERING JOURNAL",2019,23
"380","Identification of transformation products to characterize the ability of a natural wetland to degrade synthetic organic pollutants","Doudrick;Young","WATER RESEARCH",2020,4
"381","Rapid method for testing efficacy of nano-engineered coatings for mitigating tin whisker growth","Doudrick;Williams;Williams","MICROELECTRONICS RELIABILITY",2015,9
"382","Constraining particle evolution from wall losses, coagulation, and condensation-evaporation in smog-chamber experiments: Optimal estimation based on size distribution measurements","Ruiz;Adams","AEROSOL SCIENCE AND TECHNOLOGY",2008,62
"383","Effect of aerosol composition on the performance of low-cost optical particle counter correction factors","Ruiz;Young","ATMOSPHERIC MEASUREMENT TECHNIQUES",2020,11
"384","Evaluating the Mixing of Organic Aerosol Components Using High-Resolution Aerosol Mass Spectrometry","Ruiz;Kroll","ENVIRONMENTAL SCIENCE & TECHNOLOGY",2011,34
"385","Introducing the Wunderkammer as a tool for emotion research: Unconstrained gaze and movement patterns in three emotionally evocative virtual worlds","Ruiz;Hartmann","COMPUTERS IN HUMAN BEHAVIOR",2016,13
"386","Organic aerosol components observed in Northern Hemispheric datasets from Aerosol Mass Spectrometry","Ruiz;Kroll","ATMOSPHERIC CHEMISTRY AND PHYSICS",2010,611
"387","A molecular picture of surface interactions of organic compounds on prevalent indoor surfaces: limonene adsorption on SiO2","Shiraiwa;Grassian","CHEMICAL SCIENCE",2019,26
"388","Accurate Prediction of Organic Aerosol Evaporation Using Kinetic Multilayer Modeling and the Stokes-Einstein Equation","Shiraiwa;Young","JOURNAL OF PHYSICAL CHEMISTRY A",2021,1
"389","Condensed-phase biogenic-anthropogenic interactions with implications for cold cloud formation","Shiraiwa;O'Brien","FARADAY DISCUSSIONS",2017,18
"390","Emerging investigator series: chemical and physical properties of organic mixtures on indoor surfaces during HOMEChem","Shiraiwa;O'Brien;Grassian","ENVIRONMENTAL SCIENCE-PROCESSES & IMPACTS",2021,0
"391","General overview: European Integrated project on Aerosol Cloud Climate and Air Quality interactions (EUCAARI) - integrating aerosol research from nano to global scales","Shiraiwa;Carslaw","ATMOSPHERIC CHEMISTRY AND PHYSICS",2011,174
"392","Indoor aerosol water content and phase state in US residences: impacts of relative humidity, aerosol mass and composition, and mechanical system operation","Shiraiwa;Waring","ENVIRONMENTAL SCIENCE-PROCESSES & IMPACTS",2020,2
"393","Secondary organic aerosol yields of 12-carbon alkanes","Shiraiwa;Ziemann","ATMOSPHERIC CHEMISTRY AND PHYSICS",2014,63
"394","Size distribution dynamics reveal particle-phase chemistry in organic aerosol formation","Shiraiwa;Ziemann","PROCEEDINGS OF THE NATIONAL ACADEMY OF SCIENCES OF THE UNITED STATES OF AMERICA",2013,111
"395","Alternative ventilation strategies in US offices: Comprehensive assessment and sensitivity analysis of energy saving potential","Waring;Adams","BUILDING AND ENVIRONMENT",2017,21
"396","Alternative ventilation strategies in US offices: Saving energy while enhancing work performance, reducing absenteeism, and considering outdoor pollutant exposure tradeoffs","Waring;Adams","BUILDING AND ENVIRONMENT",2017,25
"397","Fungal Signature of Moisture Damage in Buildings: Identification by Targeted and Untargeted Approaches with Mycobiome Data","Waring;Adams","APPLIED AND ENVIRONMENTAL MICROBIOLOGY",2020,2
"398","Indoor secondary organic aerosols: Towards an improved representation of their formation and composition in models","Waring;Carslaw","ATMOSPHERIC ENVIRONMENT",2020,5
"399","Measuring the efficacy of HVAC particle filtration over a range of ventilation rates in an office building","Waring;Adams","BUILDING AND ENVIRONMENT",2018,10
"400","Modeling impacts of dynamic ventilation strategies on indoor air quality of offices in six US cities","Waring;Adams","BUILDING AND ENVIRONMENT",2013,44
"401","Optimizing ventilation: Theoretical study on increasing rates in offices to maximize occupant productivity with constrained additional energy use","Waring;Adams","BUILDING AND ENVIRONMENT",2019,7
"402","Reactive indoor air chemistry and health-A workshop summary","Waring;Carslaw","INTERNATIONAL JOURNAL OF HYGIENE AND ENVIRONMENTAL HEALTH",2017,19
"403","Simplified daily models for estimating energy consumption impacts of changing office building ventilation rates","Waring;Adams","BUILDING AND ENVIRONMENT",2018,4
"404","Ten questions concerning the microbiomes of buildings","Waring;Adams","BUILDING AND ENVIRONMENT",2016,76
"405","Using multiobjective optimizations to discover dynamic building ventilation strategies that can improve indoor air quality and reduce energy use","Waring;Adams","ENERGY AND BUILDINGS",2014,36
"406","Characterizing and understanding the reactivity and fate of aminoalcohols in the environment","Borduas-Dedekind;Abbatt","ABSTRACTS OF PAPERS OF THE AMERICAN CHEMICAL SOCIETY",2012,0
"407","Ion chromatographic separation and quantitation of alkyl methylamines and ethylamines in atmospheric gas and particulate matter using preconcentration and suppressed conductivity detection","Borduas-Dedekind;VandenBoer","JOURNAL OF CHROMATOGRAPHY A",2012,32
"408","Gas Phase Oxidation of Monoethanolamine (MEA) with OH Radical and Ozone: Kinetics, Products, and Particles","Borduas-Dedekind;Abbatt","ENVIRONMENTAL SCIENCE & TECHNOLOGY",2013,51
"409","Atmospheric sources and sinks of amines, amides, and isocyanic acid (HNCO)","Borduas-Dedekind;Abbatt","ABSTRACTS OF PAPERS OF THE AMERICAN CHEMICAL SOCIETY",2014,0
"410","Experimental and Theoretical Understanding of the Gas Phase Oxidation of Atmospheric Amides with OH Radicals: Kinetics, Products, and Mechanisms","Borduas-Dedekind;Abbatt","JOURNAL OF PHYSICAL CHEMISTRY A",2015,45
"411","Gas Phase Oxidation of Nicotine by OH Radicals: Kinetics, Mechanisms, and Formation of HNCO","Borduas-Dedekind;Abbatt","ENVIRONMENTAL SCIENCE & TECHNOLOGY LETTERS",2016,22
"412","Gas-Phase Mechanisms of the Reactions of Reduced Organic Nitrogen Compounds with OH Radicals","Borduas-Dedekind;Abbatt","ENVIRONMENTAL SCIENCE & TECHNOLOGY",2016,28
"413","Solubility and reactivity of HNCO in water: insights into HNCO's fate in the atmosphere","Borduas-Dedekind;Abbatt","ATMOSPHERIC CHEMISTRY AND PHYSICS",2016,27
"414","Exploring Conditions for Ultrafine Particle Formation from Oxidation of Cigarette Smoke in Indoor Environments","Borduas-Dedekind;Abbatt","ENVIRONMENTAL SCIENCE & TECHNOLOGY",2018,10
"415","Photomineralization mechanism changes the ability of dissolved organic matter to activate cloud droplets and to nucleate ice crystals","Borduas-Dedekind;McNeill","ATMOSPHERIC CHEMISTRY AND PHYSICS",2019,16
"416","Reactive Oxygen Species Production from Secondary Organic Aerosols: The Importance of Singlet Oxygen","Borduas-Dedekind;McNeill","ENVIRONMENTAL SCIENCE & TECHNOLOGY",2019,19
"417","Singlet Oxygen Photooxidation of Peptidic Oxazoles and Thiazoles","Borduas-Dedekind;McNeill","JOURNAL OF ORGANIC CHEMISTRY",2019,7
"418","UVB-irradiated Laboratory-generated Secondary Organic Aerosol Extracts Have Increased Cloud Condensation Nuclei Abilities: Comparison with Dissolved Organic Matter and Implications for the Photomineralization Mechanism","Borduas-Dedekind;McNeill","CHIMIA",2020,2
"419","A larger pool of ozone-forming carbon compounds in urban atmospheres","Carslaw;Morrison","NATURE",2000,264
"420","OH and HO2 chemistry during NAMBLEX: roles of oxygenates, halogen oxides and heterogeneous uptake","Carslaw;Williams;Williams","ATMOSPHERIC CHEMISTRY AND PHYSICS",2006,59
"421","The North Atlantic Marine Boundary Layer Experiment (NAMBLEX). Overview of the campaign held at Mace Head, Ireland, in summer 2002","Carslaw;Williams;Williams","ATMOSPHERIC CHEMISTRY AND PHYSICS",2006,44
"422","Photolysis-driven indoor air chemistry following cleaning of hospital wards","Carslaw;Kahan","INDOOR AIR",2020,4
"423","A decade of GOSAT Proxy satellite CH4 observations","Wennberg;Young","EARTH SYSTEM SCIENCE DATA",2020,7
