"","Title","Authors","Source Title","Publication Year","Total Citations"
"424","Characteristics of greenhouse gas concentrations derived from ground-based FTS spectra at Anmyeondo, South Korea","Wennberg;Young","ATMOSPHERIC MEASUREMENT TECHNIQUES",2018,5
"425","Characterization of a real-time tfor isoprene epoxydiols-derived secondary organic aerosol (IEPOX-SOA) from aerosol mass spectrometer measurements","Wennberg;Goldstein","ABSTRACTS OF PAPERS OF THE AMERICAN CHEMICAL SOCIETY",2015,0
"426","Chemical transport models often underestimate inorganic aerosol acidity in remote regions of the atmosphere","Wennberg;Williams;Williams","COMMUNICATIONS EARTH & ENVIRONMENT",2021,2
"427","Evaluation of MOPITT Version 7 joint TIR-NIR X-CO retrievals with TCCON","Wennberg;Young","ATMOSPHERIC MEASUREMENT TECHNIQUES",2019,8
"428","Hydroxymethanesulfonate (HMS) Formation during Summertime Fog in an Arctic Oil Field","Wennberg;Rim","ENVIRONMENTAL SCIENCE & TECHNOLOGY LETTERS",2021,0
"429","Measurement of atmospheric nitrous acid at Blodgett Forest during BEARPEX2007 (vol 10, pg 6283, 2010)","Wennberg;Goldstein","ATMOSPHERIC CHEMISTRY AND PHYSICS",2010,0
"430","New insights into low-NOx isoprene oxidation chemistry","Wennberg;Abbatt","ABSTRACTS OF PAPERS OF THE AMERICAN CHEMICAL SOCIETY",2016,0
"431","OCO-3 early mission operations and initial (vEarly) XCO2 and SIF retrievals","Wennberg;Vance","REMOTE SENSING OF ENVIRONMENT",2020,14
"432","Organic nitrate contribution to the oxidized nitrogen budget at the 2013 Southern Oxidant and Aerosol Study (SOAS)","Wennberg;Goldstein;de Gouw","ABSTRACTS OF PAPERS OF THE AMERICAN CHEMICAL SOCIETY",2014,0
"433","The ACOS CO2 retrieval algorithm - Part 1: Description and validation against synthetic observations","Wennberg;O'Brien","ATMOSPHERIC MEASUREMENT TECHNIQUES",2012,333
"434","The ACOS CO2 retrieval algorithm - Part II: Global X-CO2 data characterization","Wennberg;O'Brien","ATMOSPHERIC MEASUREMENT TECHNIQUES",2012,205
"435","The Orbiting Carbon Observatory-2: first 18 months of science data products","Wennberg;O'Brien","ATMOSPHERIC MEASUREMENT TECHNIQUES",2017,105
"436","Toward accurate CO2 and CH4 observations from GOSAT","Wennberg;Hartmann","GEOPHYSICAL RESEARCH LETTERS",2011,243
"437","Wet scavenging of soluble gases in DC3 deep convective storms using WRF-Chem simulations and aircraft observations","Wennberg;Morrison","JOURNAL OF GEOPHYSICAL RESEARCH-ATMOSPHERES",2016,24
"438","OH and HO2 radical chemistry during PROPHET 2008 and CABINEX 2009-Part 1: Measurements and model comparison","Stevens;O'Brien","ATMOSPHERIC CHEMISTRY AND PHYSICS",2013,39
"439","Chamber Bioaerosol Study: Outdoor Air and Human Occupants as Sources of Indoor Airborne Microbes","Adams;Nazaroff","PLOS ONE",2015,106
"440","From commensalism to mutualism: integrating the microbial ecology, building science, and indoor air communities to advance research on the indoor microbiome","Adams;Waring","INDOOR AIR",2015,7
"441","Chamber bioaerosol study: human emissions of size-resolved fluorescent biological aerosol particles","Adams;Nazaroff","INDOOR AIR",2016,70
"442","Ten questions concerning the implications of carpet on indoor chemistry and microbiology","Adams;Morrison","BUILDING AND ENVIRONMENT",2020,6
"443","Fmoc-Diphenylalanine self assembles to a hydrogel via a novel architecture based on pi-pi interlocked beta-sheets","Ulijn;Williams;Williams","ADVANCED MATERIALS",2008,677
"444","Exploiting Biocatalysis in Peptide Self-Assembly","Ulijn;Williams;Williams","BIOPOLYMERS",2010,70
"445","Sequence/structure relationships in aromatic dipeptide hydrogels formed under thermodynamic control by enzyme-assisted self-assembly","Ulijn;Adams","SOFT MATTER",2012,67
"446","Comparison of Methods for Surface Modification of Barium Titanate Nanoparticles for Aqueous Dispersibility: Toward Biomedical Utilization of Perovskite Oxides","Ulijn;O'Brien","ACS APPLIED MATERIALS & INTERFACES",2020,2
"447","In Situ, Noncovalent Labeling and Stimulated Emission Depletion-Based Super-Resolution Imaging of Supramolecular Peptide Nanostructures","Ulijn;O'Brien","ACS NANO",2020,1
"448","Chemical Morphology Controls Reactivity of OH Radicals at the AirIce Interface","Kahan;Donaldson","The Journal of Physical Chemistry A",2021,0
"449","A review of airice chemical and physical interactions (AICI): liquids, quasi-liquids, and solids in snow","Kahan;Abbatt;McNeill","Atmospheric chemistry and physics",2014,214
"450","Relationship between snow microstructure and physical and chemical processes.","Kahan;Abbatt","Atmospheric Chemistry & Physics Discussions",2012,32
"451","Benzene photolysis on ice: Implications for the fate of organic contaminants in the winter","Kahan;Donaldson","Environmental science & technology",2010,64
"452","Anthracene photolysis in aqueous solution and ice: Photon flux dependence and comparison of kinetics in bulk ice and at the air ice interface","Kahan;Donaldson","Environmental science & technology",2010,52
"453","Mechanism of aqueous-phase ozonation of S (IV)","Kahan;Donaldson","The Journal of Physical Chemistry A",2010,6
"454","Self-association of naphthalene at the air ice interface","Kahan;Donaldson","The Journal of Physical Chemistry A",2009,46
"455","Heterogeneous ozonation kinetics of phenanthrene at the airice interface","Kahan;Donaldson","Environmental Research Letters",2008,45
"456","Aqueous aerosol SOA formation: impact on aerosol physical properties","McNeill;Ruiz","FARADAY DISCUSSIONS",2013,40
"457","A laboratory investigation of light scattering from representative components of mineral dust aerosol at a wavelength of 550 nm","Grassian;Young","JOURNAL OF GEOPHYSICAL RESEARCH-ATMOSPHERES",2008,58
"458","Coupled infrared extinction and size distribution measurements for several clay components of mineral dust aerosol","Grassian;Young","JOURNAL OF GEOPHYSICAL RESEARCH-ATMOSPHERES",2008,50
"459","Coupled infrared extinction spectra and size distribution measurements for several non-clay components of mineral dust aerosol (quartz, calcite, and dolomite)","Grassian;Young","ATMOSPHERIC ENVIRONMENT",2008,32
"460","Extinction spectra of mineral dust aerosol components in an environmental aerosol chamber: IR resonance studies","Grassian;Young","ATMOSPHERIC ENVIRONMENT",2008,11
"461","Reactive uptake of acetic acid on calcite and nitric acid reacted calcite aerosol in an environmental reaction chamber","Grassian;Young","PHYSICAL CHEMISTRY CHEMICAL PHYSICS",2008,37
"462","Effect of Ozone and Relative Humidity on the Heterogeneous Uptake of Octamethylcyclotetrasiloxane and Decamethylcyclopentasiloxane on Model Mineral Dust Aerosol Components","Grassian;Young","JOURNAL OF PHYSICAL CHEMISTRY A",2009,13
"463","Heterogeneous uptake of octamethylcyclotetrasiloxane (D-4) and decamethylcyclopentasiloxane (D-5) onto mineral dust aerosol under variable RH conditions","Grassian;Young","ATMOSPHERIC ENVIRONMENT",2009,19
"464","T-matrix studies of aerosol particle shape effects on IR resonance spectral line profiles and comparison with an experiment","Grassian;Young","JOURNAL OF GEOPHYSICAL RESEARCH-ATMOSPHERES",2009,15
"465","A Kinetic Study of Ozone Decomposition on Illuminated Oxide Surfaces","Grassian;Young","JOURNAL OF PHYSICAL CHEMISTRY A",2011,37
"466","Heterogeneous Photochemistry of Trace Atmospheric Gases with Components of Mineral Dust Aerosol","Grassian;Young","JOURNAL OF PHYSICAL CHEMISTRY A",2011,48
"467","Visible light scattering study at 470, 550, and 660 nm of components of mineral dust aerosol: Hematite and goethite","Grassian;Young","JOURNAL OF QUANTITATIVE SPECTROSCOPY & RADIATIVE TRANSFER",2011,25
"468","Evidence for particle size-shape correlations in the optical properties of silicate clay aerosol","Grassian;Young","JOURNAL OF QUANTITATIVE SPECTROSCOPY & RADIATIVE TRANSFER",2012,11
"469","Infrared extinction spectra of mineral dust aerosol: Single components and complex mixtures","Grassian;Young","JOURNAL OF GEOPHYSICAL RESEARCH-ATMOSPHERES",2012,15
"470","A combined laboratory and modeling study of the infrared extinction and visible light scattering properties of mineral dust aerosol","Grassian;Young","JOURNAL OF GEOPHYSICAL RESEARCH-ATMOSPHERES",2013,10
"471","Infrared extinction spectroscopy and micro-Raman spectroscopy of select components of mineral dust mixed with organic compounds","Grassian;Young","JOURNAL OF GEOPHYSICAL RESEARCH-ATMOSPHERES",2013,24
"472","Infrared Optical Constants of Organic Aerosols: Organic Acids and Model Humic-Like Substances (HULIS)","Grassian;Young","AEROSOL SCIENCE AND TECHNOLOGY",2014,7
"473","Optical properties of selected components of mineral dust aerosol processed with organic acids and humic material","Grassian;Young","JOURNAL OF GEOPHYSICAL RESEARCH-ATMOSPHERES",2015,16
"474","NanoEHS - defining fundamental science needs: no easy feat when the simple itself is complex","Grassian;Young","ENVIRONMENTAL SCIENCE-NANO",2016,46
"475","Optical and Physicochemical Properties of Brown Carbon Aerosol: Light Scattering, FTIR Extinction Spectroscopy, and Hygroscopic Growth","Grassian;Young","JOURNAL OF PHYSICAL CHEMISTRY A",2016,32
"476","Optical Properties of Humic Material Standards: Solution Phase and Aerosol Measurements","Grassian;Young","ACS EARTH AND SPACE CHEMISTRY",2018,9
"477","Optical Property Measurements and Single Particle Analysis of Secondary Organic Aerosol Produced from the Aqueous-Phase Reaction of Ammonium Sulfate with Methylglyoxal","Grassian;Young","ACS EARTH AND SPACE CHEMISTRY",2018,5
